{
  "$schema": "https://lovdacn.vercel.app/schema/registry-item.json",
  "name": "tooltip",
  "dependencies": [
    "@rn-primitives/tooltip@^1.5.2",
    "@rn-primitives/portal@^1.5.2"
  ],
  "registryDependencies": [
    "native-only-animated-view",
    "text",
    "utils"
  ],
  "files": [
    {
      "path": "components/ui/tooltip.tsx",
      "content": "import { NativeOnlyAnimatedView } from '@/components/ui/native-only-animated-view';\nimport { TextClassContext } from '@/components/ui/text';\nimport { cn } from '@/lib/utils';\nimport * as TooltipPrimitive from '@rn-primitives/tooltip';\nimport * as React from 'react';\nimport { Platform, StyleSheet } from 'react-native';\nimport { FadeInDown, FadeInUp, FadeOut } from 'react-native-reanimated';\nimport { FullWindowOverlay as RNFullWindowOverlay } from 'react-native-screens';\n\nconst Tooltip = TooltipPrimitive.Root;\n\nconst TooltipTrigger = TooltipPrimitive.Trigger;\n\nconst FullWindowOverlay = Platform.OS === 'ios' ? RNFullWindowOverlay : React.Fragment;\n\nfunction TooltipContent({\n  className,\n  sideOffset = 4,\n  portalHost,\n  side = 'top',\n  ...props\n}: React.ComponentProps<typeof TooltipPrimitive.Content> & {\n    portalHost?: string;\n  }) {\n  return (\n    <TooltipPrimitive.Portal hostName={portalHost}>\n      <FullWindowOverlay>\n        <TooltipPrimitive.Overlay style={Platform.select({ native: StyleSheet.absoluteFill })}>\n          <NativeOnlyAnimatedView\n            entering={\n              side === 'top'\n                ? FadeInDown.withInitialValues({ transform: [{ translateY: 3 }] }).duration(150)\n                : FadeInUp.withInitialValues({ transform: [{ translateY: -5 }] })\n            }\n            exiting={FadeOut}>\n            <TextClassContext.Provider value=\"text-xs text-primary-foreground\">\n              <TooltipPrimitive.Content\n                sideOffset={sideOffset}\n                className={cn(\n                  'bg-primary z-50 sm:py-1.5 items-center gap-1.5 rounded-md px-3 py-1.5 text-xs',\n                  Platform.select({\n                    web: cn(\n                      'animate-in fade-in-0 zoom-in-95 origin-(--radix-tooltip-content-transform-origin) w-fit text-balance',\n                      side === 'bottom' && 'slide-in-from-top-2',\n                      side === 'left' && 'slide-in-from-right-2',\n                      side === 'right' && 'slide-in-from-left-2',\n                      side === 'top' && 'slide-in-from-bottom-2'\n                    ),\n                  }),\n                  className\n                )}\n                side={side}\n                {...props}\n              />\n            </TextClassContext.Provider>\n          </NativeOnlyAnimatedView>\n        </TooltipPrimitive.Overlay>\n      </FullWindowOverlay>\n    </TooltipPrimitive.Portal>\n  );\n}\n\nexport { Tooltip, TooltipContent, TooltipTrigger };\n",
      "type": "registry:ui"
    }
  ],
  "meta": {
    "engine": "nativewind",
    "style": "default",
    "recipeStyle": "vega",
    "legacy": true
  },
  "type": "registry:ui"
}
