{
  "$schema": "https://lovdacn.vercel.app/schema/registry-item.json",
  "name": "primitives",
  "dependencies": [],
  "registryDependencies": [],
  "files": [
    {
      "path": "components/ui/primitives.tsx",
      "content": "/**\n * primitives — host indirection layer for lovdaCN. [PLAIN VARIANT]\n *\n * Components render their hosts from this file instead of importing them from\n * `react-native` directly:\n *\n *   import { Pressable, View, Text, TextInput } from '@/components/ui/primitives';\n *\n * THIS is the plain variant: it accepts the shared animation props so component\n * prop types compile, then **discards** them and renders the raw React Native\n * host. It imports no animation library, so a project that never installs\n * animation ships zero Reanimated.\n *\n * Run `lovdacn add motion` to replace this file with the motion-aware variant.\n * Every component that renders through these hosts then honours `animate` /\n * `activeAnimate` with no changes to the components themselves.\n *\n * The types below are the same shape the motion engine exposes, and they are\n * erased at runtime — they cost nothing.\n */\nimport {\n  Pressable as RNPressable,\n  Text as RNText,\n  TextInput as RNTextInput,\n  View as RNView,\n} from 'react-native';\n\n/* -------------------------------------------------------------------------------------------------\n * Shared animation types (runtime-erased)\n * -----------------------------------------------------------------------------------------------*/\n\nexport type MotionTarget = {\n  opacity?: number;\n  scale?: number;\n  scaleX?: number;\n  scaleY?: number;\n  translateX?: number;\n  translateY?: number;\n  rotate?: `${number}deg`;\n  rotateX?: `${number}deg`;\n  rotateY?: `${number}deg`;\n  backgroundColor?: string;\n  borderColor?: string;\n  color?: string;\n  borderRadius?: number;\n};\n\nexport type MotionTransition =\n  | {\n      type: 'spring';\n      damping?: number;\n      stiffness?: number;\n      mass?: number;\n      overshootClamping?: boolean;\n      delay?: number;\n    }\n  | {\n      type: 'timing';\n      duration?: number;\n      easing?: 'linear' | 'ease-in' | 'ease-out' | 'ease-in-out';\n      delay?: number;\n    };\n\nexport type MotionPresetName =\n  | 'fade-in'\n  | 'fade-out'\n  | 'slide-up'\n  | 'slide-down'\n  | 'slide-left'\n  | 'slide-right'\n  | 'zoom-in'\n  | 'zoom-out'\n  | 'pop'\n  | 'press'\n  | 'spin'\n  | 'pulse'\n  | 'bounce'\n  | 'shake'\n  | 'wiggle';\n\nexport interface AnimateConfig {\n  initial?: MotionTarget;\n  to?: MotionTarget;\n  exit?: MotionTarget;\n  transition?: MotionTransition;\n  repeat?: number | 'infinite';\n  reverse?: boolean;\n}\n\nexport type ActiveState =\n  | 'press'\n  | 'hover'\n  | 'focus'\n  | 'checked'\n  | 'selected'\n  | 'current'\n  | 'open'\n  | 'expanded'\n  | 'visible'\n  | 'loading'\n  | 'dragging';\n\nexport interface ActiveStateConfig {\n  to: MotionTarget;\n  transition?: MotionTransition;\n}\n\nexport interface ActiveAnimateConfig {\n  to?: MotionTarget;\n  transition?: MotionTransition;\n  states?: Partial<Record<ActiveState, ActiveStateConfig>>;\n}\n\n/** Preset name, utility string (e.g. 'fade-in slide-up duration-200'), config object, or \false. */\nexport type MotionUtilityString = string & {};\nexport type AnimateProp = false | MotionPresetName | MotionUtilityString | AnimateConfig;\nexport type ActiveAnimateProp =\n  | false\n  | MotionPresetName\n  | MotionUtilityString\n  | MotionTarget\n  | ActiveAnimateConfig;\n\nexport interface SharedAnimationProps {\n  /** Idle, mount, exit, or continuous animation. `false` disables it. */\n  animate?: AnimateProp;\n  /** Motion applied while the component's semantic active state is true. */\n  activeAnimate?: ActiveAnimateProp;\n  /** Explicit active-state override for components without intrinsic state. */\n  motionActive?: boolean;\n  /** Defaults to `system`. */\n  reduceMotion?: 'system' | 'always' | 'never';\n}\n\n/* -------------------------------------------------------------------------------------------------\n * Shared timing tokens\n * -----------------------------------------------------------------------------------------------*/\n\n/**\n * The single vocabulary for animation duration/easing across lovdaCN. Declared here (not\n * imported from the engine) so components have one set of timing tokens even when no\n * animation runtime is installed.\n *\n * These values are mirrored by `@/components/ui/motion` and by the Tailwind `duration-*`\n * classes used on web — keep all three in sync so an animation looks the same whichever\n * system drives it.\n */\nexport const durations = {\n  instant: 0,\n  fast: 150,\n  base: 200,\n  slow: 250,\n  slower: 300,\n} as const;\n\nexport const transitions = {\n  /** Quick exits and dismissals. */\n  fast: { type: 'timing', duration: durations.fast, easing: 'ease-out' },\n  /** Default enter/idle transition. */\n  base: { type: 'timing', duration: durations.base, easing: 'ease-out' },\n  /** Slower, more deliberate movement (sheets, drawers). */\n  slow: { type: 'timing', duration: durations.slow, easing: 'ease-out' },\n  /** Crisp interaction feedback — the default for press/active states. */\n  springSnappy: { type: 'spring', damping: 18, stiffness: 240, mass: 1 },\n  /** Gentle, settling movement. */\n  springSoft: { type: 'spring', damping: 20, stiffness: 120, mass: 1 },\n  /** Playful overshoot. */\n  springBouncy: { type: 'spring', damping: 10, stiffness: 260, mass: 1 },\n} satisfies Record<string, MotionTransition>;\n\n/* -------------------------------------------------------------------------------------------------\n * Hosts — accept the animation props, ignore them, render the plain host\n * -----------------------------------------------------------------------------------------------*/\n\nfunction withoutMotionProps<T extends SharedAnimationProps>(props: T) {\n  // Strip so nothing unknown reaches the native/DOM host.\n  const { animate, activeAnimate, motionActive, reduceMotion, ...rest } = props;\n  return rest;\n}\n\ntype PlainProps<C> = React.ComponentProps<C> & SharedAnimationProps;\n\nfunction Pressable(props: PlainProps<typeof RNPressable>) {\n  return <RNPressable {...withoutMotionProps(props)} />;\n}\n\nfunction View(props: PlainProps<typeof RNView>) {\n  return <RNView {...withoutMotionProps(props)} />;\n}\n\nfunction Text(props: PlainProps<typeof RNText>) {\n  return <RNText {...withoutMotionProps(props)} />;\n}\n\nfunction TextInput(props: PlainProps<typeof RNTextInput>) {\n  return <RNTextInput {...withoutMotionProps(props)} />;\n}\n\n/**\n * Host INSTANCE types, exported under the same names as the components above.\n * TypeScript keeps types and values in separate declaration spaces, so `View` is both\n * the component (value) and the underlying host instance type. That keeps existing\n * component code working unchanged:\n *\n *   React.ComponentProps<typeof View>   → the component's props\n *   React.RefAttributes<View>           → a ref to the real native host\n */\ntype View = RNView;\ntype Text = RNText;\ntype TextInput = RNTextInput;\ntype Pressable = React.ComponentRef<typeof RNPressable>;\n\nexport { Pressable, Text, TextInput, View };\n",
      "type": "registry:ui"
    }
  ],
  "meta": {
    "engine": "uniwind",
    "style": "rhea",
    "legacy": false
  },
  "type": "registry:ui"
}
