{
  "$schema": "https://lovdacn.vercel.app/schema/registry-item.json",
  "name": "collapsible",
  "dependencies": [
    "@rn-primitives/collapsible"
  ],
  "registryDependencies": [],
  "files": [
    {
      "path": "components/ui/collapsible.tsx",
      "content": "import * as CollapsiblePrimitive from '@rn-primitives/collapsible';\n\nconst Collapsible = CollapsiblePrimitive.Root;\n\nconst CollapsibleTrigger = CollapsiblePrimitive.Trigger;\n\nconst CollapsibleContent = CollapsiblePrimitive.Content;\n\nexport { Collapsible, CollapsibleTrigger, CollapsibleContent };\n",
      "type": "registry:ui"
    }
  ],
  "meta": {
    "engine": "nativewind",
    "style": "luma"
  },
  "type": "registry:ui"
}
