{
  "$schema": "https://lovdacn.vercel.app/schema/registry-item.json",
  "name": "card",
  "dependencies": [],
  "registryDependencies": [
    "text",
    "utils",
    "primitives"
  ],
  "files": [
    {
      "path": "components/ui/card.tsx",
      "content": "import { Text, TextClassContext } from '@/components/ui/text';\nimport { cn } from '@/lib/utils';\nimport { View } from '@/components/ui/primitives';\n\nfunction Card({ className, ...props }: React.ComponentProps<typeof View> & React.RefAttributes<View>) {\n  return (\n    <TextClassContext.Provider value=\"text-card-foreground\">\n      <View\n        className={cn(\n          'border-border flex flex-col gap-6 border py-6 shadow-sm shadow-black/5 ring-foreground/10 bg-card text-card-foreground overflow-hidden rounded-lg text-xs/relaxed ring-1',\n          className\n        )}\n        {...props}\n      />\n    </TextClassContext.Provider>\n  );\n}\n\nfunction CardHeader({ className, ...props }: React.ComponentProps<typeof View> & React.RefAttributes<View>) {\n  return <View className={cn('flex flex-col px-6 gap-1 rounded-t-lg', className)} {...props} />;\n}\n\nfunction CardTitle({\n  className,\n  ref,\n  ...props\n}: React.ComponentProps<typeof Text> & React.RefAttributes<typeof Text>) {\n\n  return (\n    <Text\n      ref={ref}\n      role=\"heading\"\n      aria-level={3}\n      className={cn('text-sm font-medium', className)}\n      {...props}\n    />\n  );\n}\n\nfunction CardDescription({\n  className,\n  ...props\n}: React.ComponentProps<typeof Text> & React.RefAttributes<typeof Text>) {\n  return <Text className={cn('text-muted-foreground text-xs/relaxed', className)} {...props} />;\n}\n\nfunction CardContent({ className, ...props }: React.ComponentProps<typeof View> & React.RefAttributes<View>) {\n  return <View className={cn('px-6', className)} {...props} />;\n}\n\nfunction CardFooter({ className, ...props }: React.ComponentProps<typeof View> & React.RefAttributes<View>) {\n  return <View className={cn('flex flex-row items-center px-6 rounded-b-lg', className)} {...props} />;\n}\n\nexport { Card, CardContent, CardDescription, CardFooter, CardHeader, CardTitle };\n",
      "type": "registry:ui"
    }
  ],
  "meta": {
    "engine": "nativewind",
    "style": "mira"
  },
  "type": "registry:ui"
}
