{
  "$schema": "https://lovdacn.vercel.app/schema/registry-item.json",
  "name": "aspect-ratio",
  "dependencies": [
    "@rn-primitives/aspect-ratio"
  ],
  "registryDependencies": [],
  "files": [
    {
      "path": "components/ui/aspect-ratio.tsx",
      "content": "import * as AspectRatioPrimitive from '@rn-primitives/aspect-ratio';\n\nconst AspectRatio = AspectRatioPrimitive.Root;\n\nexport { AspectRatio };\n",
      "type": "registry:ui"
    }
  ],
  "meta": {
    "engine": "nativewind",
    "style": "mira"
  },
  "type": "registry:ui"
}
