{
  "$schema": "https://lvcn.dev/schema/registry-item.json",
  "name": "alert-dialog",
  "dependencies": [
    "@rn-primitives/alert-dialog"
  ],
  "registryDependencies": [
    "button",
    "native-only-animated-view",
    "text",
    "utils"
  ],
  "files": [
    {
      "path": "components/ui/alert-dialog.tsx",
      "content": "import { buttonTextVariants, buttonVariants } from '@/components/ui/button';\nimport { NativeOnlyAnimatedView } from '@/components/ui/native-only-animated-view';\nimport { TextClassContext } from '@/components/ui/text';\nimport { cn } from '@/lib/utils';\nimport * as AlertDialogPrimitive from '@rn-primitives/alert-dialog';\nimport * as React from 'react';\nimport { Platform, View, type ViewProps } from 'react-native';\nimport { FadeIn, FadeOut } from 'react-native-reanimated';\nimport { FullWindowOverlay as RNFullWindowOverlay } from 'react-native-screens';\n\nconst AlertDialog = AlertDialogPrimitive.Root;\n\nconst AlertDialogTrigger = AlertDialogPrimitive.Trigger;\n\nconst AlertDialogPortal = AlertDialogPrimitive.Portal;\n\nconst FullWindowOverlay = Platform.OS === 'ios' ? RNFullWindowOverlay : React.Fragment;\n\nfunction AlertDialogOverlay({\n  className,\n  children,\n  ...props\n}: Omit<React.ComponentProps<typeof AlertDialogPrimitive.Overlay>, 'asChild'> & {\n    children?: React.ReactNode;\n  }) {\n  return (\n    <FullWindowOverlay>\n      <AlertDialogPrimitive.Overlay\n        className={cn(\n          'absolute bottom-0 left-0 right-0 top-0 z-50 flex items-center justify-center bg-black/50 p-2',\n          Platform.select({\n            web: 'animate-in fade-in-0 fixed',\n          }),\n          className\n        )}\n        {...props}>\n        <NativeOnlyAnimatedView\n          entering={FadeIn.duration(200).delay(50)}\n          exiting={FadeOut.duration(150)}>\n          <>{children}</>\n        </NativeOnlyAnimatedView>\n      </AlertDialogPrimitive.Overlay>\n    </FullWindowOverlay>\n  );\n}\n\nfunction AlertDialogContent({\n  className,\n  portalHost,\n  ...props\n}: React.ComponentProps<typeof AlertDialogPrimitive.Content> & {\n    portalHost?: string;\n  }) {\n  return (\n    <AlertDialogPortal hostName={portalHost}>\n      <AlertDialogOverlay>\n        <AlertDialogPrimitive.Content\n          className={cn(\n            'bg-background border-border z-50 flex w-full max-w-[calc(100%-2rem)] flex-col gap-4 rounded-full border p-6 shadow-lg shadow-black/5 sm:max-w-lg',\n            Platform.select({\n              web: 'animate-in fade-in-0 zoom-in-95 duration-200',\n            }),\n            className\n          )}\n          {...props}\n        />\n      </AlertDialogOverlay>\n    </AlertDialogPortal>\n  );\n}\n\nfunction AlertDialogHeader({ className, ...props }: ViewProps) {\n  return (\n    <TextClassContext.Provider value=\"text-center sm:text-left\">\n      <View className={cn('flex flex-col gap-2', className)} {...props} />\n    </TextClassContext.Provider>\n  );\n}\n\nfunction AlertDialogFooter({ className, ...props }: ViewProps) {\n  return (\n    <View\n      className={cn('flex flex-col-reverse gap-2 sm:flex-row sm:justify-end', className)}\n      {...props}\n    />\n  );\n}\n\nfunction AlertDialogTitle({\n  className,\n  ...props\n}: React.ComponentProps<typeof AlertDialogPrimitive.Title>) {\n  return (\n    <AlertDialogPrimitive.Title\n      className={cn('text-foreground text-lg font-semibold', className)}\n      {...props}\n    />\n  );\n}\n\nfunction AlertDialogDescription({\n  className,\n  ...props\n}: React.ComponentProps<typeof AlertDialogPrimitive.Description>) {\n  return (\n    <AlertDialogPrimitive.Description\n      className={cn('text-muted-foreground *:[a]:hover:text-foreground text-xs/relaxed text-balance md:text-pretty *:[a]:underline *:[a]:underline-offset-3 text-muted-foreground text-sm', className)}\n      {...props}\n    />\n  );\n}\n\nfunction AlertDialogAction({\n  className,\n  ...props\n}: React.ComponentProps<typeof AlertDialogPrimitive.Action>) {\n  return (\n    <TextClassContext.Provider value={buttonTextVariants({ className })}>\n      <AlertDialogPrimitive.Action className={cn(buttonVariants(), className)} {...props} />\n    </TextClassContext.Provider>\n  );\n}\n\nfunction AlertDialogCancel({\n  className,\n  ...props\n}: React.ComponentProps<typeof AlertDialogPrimitive.Cancel>) {\n  return (\n    <TextClassContext.Provider value={buttonTextVariants({ className, variant: 'outline' })}>\n      <AlertDialogPrimitive.Cancel\n        className={cn(buttonVariants({ variant: 'outline' }), className)}\n        {...props}\n      />\n    </TextClassContext.Provider>\n  );\n}\n\nexport {\n  AlertDialog,\n  AlertDialogAction,\n  AlertDialogCancel,\n  AlertDialogContent,\n  AlertDialogDescription,\n  AlertDialogFooter,\n  AlertDialogHeader,\n  AlertDialogOverlay,\n  AlertDialogPortal,\n  AlertDialogTitle,\n  AlertDialogTrigger,\n};\n",
      "type": "registry:ui"
    }
  ],
  "meta": {
    "engine": "nativewind",
    "style": "mira"
  },
  "type": "registry:ui"
}
