{
  "$schema": "https://lovdacn.vercel.app/schema/registry-item.json",
  "name": "calendar",
  "dependencies": [],
  "registryDependencies": [
    "semantic-icon",
    "primitives",
    "utils"
  ],
  "files": [
    {
      "path": "components/ui/calendar.tsx",
      "content": "import * as React from 'react';\nimport { Pressable, Text, View } from '@/components/ui/primitives';\nimport { cn } from '@/lib/utils';\nimport { ChevronLeft, ChevronRight } from '@/components/ui/semantic-icon';\n\ninterface CalendarProps {\n  value?: Date;\n  onChange?: (date: Date) => void;\n  className?: string;\n}\n\nfunction Calendar({ value, onChange, className }: CalendarProps) {\n  const [currentDate, setCurrentDate] = React.useState(value || new Date());\n  const selectedDate = value;\n\n  const year = currentDate.getFullYear();\n  const month = currentDate.getMonth();\n\n  // Get first day of month and total days in month\n  const firstDayIndex = new Date(year, month, 1).getDay();\n  const totalDays = new Date(year, month + 1, 0).getDate();\n\n  // Get total days in previous month\n  const totalDaysPrevMonth = new Date(year, month, 0).getDate();\n\n  const monthNames = [\n    'January', 'February', 'March', 'April', 'May', 'June',\n    'July', 'August', 'September', 'October', 'November', 'December'\n  ];\n\n  const weekdays = ['Su', 'Mo', 'Tu', 'We', 'Th', 'Fr', 'Sa'];\n\n  const days = [];\n\n  // Previous month offset days\n  for (let i = firstDayIndex - 1; i >= 0; i--) {\n    days.push({\n      day: totalDaysPrevMonth - i,\n      isCurrentMonth: false,\n      date: new Date(year, month - 1, totalDaysPrevMonth - i),\n    });\n  }\n\n  // Current month days\n  for (let i = 1; i <= totalDays; i++) {\n    days.push({\n      day: i,\n      isCurrentMonth: true,\n      date: new Date(year, month, i),\n    });\n  }\n\n  // Next month offset days to complete the calendar grid rows (6 rows * 7 days = 42 cells)\n  const remainingCells = 42 - days.length;\n  for (let i = 1; i <= remainingCells; i++) {\n    days.push({\n      day: i,\n      isCurrentMonth: false,\n      date: new Date(year, month + 1, i),\n    });\n  }\n\n  const handlePrevMonth = () => {\n    setCurrentDate(new Date(year, month - 1, 1));\n  };\n\n  const handleNextMonth = () => {\n    setCurrentDate(new Date(year, month + 1, 1));\n  };\n\n  const isToday = (date: Date) => {\n    const today = new Date();\n    return (\n      date.getDate() === today.getDate() &&\n      date.getMonth() === today.getMonth() &&\n      date.getFullYear() === today.getFullYear()\n    );\n  };\n\n  const isSelected = (date: Date) => {\n    if (!selectedDate) return false;\n    return (\n      date.getDate() === selectedDate.getDate() &&\n      date.getMonth() === selectedDate.getMonth() &&\n      date.getFullYear() === selectedDate.getFullYear()\n    );\n  };\n\n  const handleDateSelect = (date: Date) => {\n    if (onChange) {\n      onChange(date);\n    }\n  };\n\n  return (\n    <View className={cn('p-3 rounded-lg border border-border bg-background w-full max-w-[320px]', className)}>\n      {/* Header */}\n      <View className=\"flex-row items-center justify-between mb-4\">\n        <Text className=\"text-sm font-semibold text-foreground\">\n          {monthNames[month]} {year}\n        </Text>\n        <View className=\"flex-row gap-1\">\n          <Pressable\n            onPress={handlePrevMonth}\n            className=\"p-1.5 rounded-md border border-border active:bg-muted\"\n          >\n            <ChevronLeft size={16} className=\"text-foreground\" />\n          </Pressable>\n          <Pressable\n            onPress={handleNextMonth}\n            className=\"p-1.5 rounded-md border border-border active:bg-muted\"\n          >\n            <ChevronRight size={16} className=\"text-foreground\" />\n          </Pressable>\n        </View>\n      </View>\n\n      {/* Weekdays */}\n      <View className=\"flex-row justify-between mb-2\">\n        {weekdays.map((day, index) => (\n          <View key={index} className=\"w-8 items-center\">\n            <Text className=\"text-xs text-muted-foreground font-medium\">{day}</Text>\n          </View>\n        ))}\n      </View>\n\n      {/* Days Grid */}\n      <View className=\"flex-row flex-wrap justify-between\">\n        {days.map((item, index) => {\n          const selected = isSelected(item.date);\n          const today = isToday(item.date);\n\n          return (\n            <Pressable\n              key={index}\n              onPress={() => handleDateSelect(item.date)}\n              className={cn(\n                'w-8 h-8 items-center justify-center rounded-md my-0.5',\n                selected && 'bg-primary text-primary-foreground',\n                !selected && today && 'bg-accent text-accent-foreground',\n                !selected && !today && 'active:bg-muted'\n              )}\n            >\n              <Text\n                className={cn(\n                  'text-xs font-medium',\n                  selected ? 'text-primary-foreground' : 'text-foreground',\n                  !item.isCurrentMonth && 'text-muted-foreground opacity-50'\n                )}\n              >\n                {item.day}\n              </Text>\n            </Pressable>\n          );\n        })}\n      </View>\n    </View>\n  );\n}\n\nCalendar.displayName = 'Calendar';\n\nexport { Calendar };\nexport type { CalendarProps };\n",
      "type": "registry:ui"
    }
  ],
  "meta": {
    "engine": "nativewind",
    "style": "luma",
    "legacy": false
  },
  "type": "registry:ui"
}
