{
  "$schema": "https://lovdacn.vercel.app/schema/registry-item.json",
  "name": "bottom-sheet",
  "dependencies": [
    "@rn-primitives/dialog",
    "react-native-reanimated",
    "react-native-screens",
    "lucide-react-native"
  ],
  "registryDependencies": [
    "icon",
    "primitives",
    "text",
    "utils",
    "native-only-animated-view"
  ],
  "files": [
    {
      "path": "components/ui/bottom-sheet.tsx",
      "content": "import { Icon } from '@/components/ui/icon';\nimport { NativeOnlyAnimatedView } from '@/components/ui/native-only-animated-view';\nimport { cn } from '@/lib/utils';\nimport * as DialogPrimitive from '@rn-primitives/dialog';\nimport { X } from 'lucide-react-native';\nimport * as React from 'react';\nimport { durations, Text, View } from '@/components/ui/primitives';\nimport { Platform, type GestureResponderEvent, type ViewProps } from 'react-native';\nimport { FadeIn, FadeOut, SlideInDown, SlideOutDown } from 'react-native-reanimated';\nimport { FullWindowOverlay as RNFullWindowOverlay } from 'react-native-screens';\n\nconst BottomSheet = DialogPrimitive.Root;\nconst BottomSheetTrigger = DialogPrimitive.Trigger;\nconst BottomSheetPortal = DialogPrimitive.Portal;\nconst BottomSheetClose = DialogPrimitive.Close;\n\nconst FullWindowOverlay = Platform.OS === 'ios' ? RNFullWindowOverlay : React.Fragment;\n\nfunction BottomSheetOverlay({\n  className,\n  children,\n  onPress,\n  ...props\n}: Omit<React.ComponentProps<typeof DialogPrimitive.Overlay>, 'asChild'> & {\n  children?: React.ReactNode;\n}) {\n  const { onOpenChange } = DialogPrimitive.useRootContext();\n\n  function onOverlayPress(event: GestureResponderEvent) {\n    onPress?.(event);\n    if (event.target === event.currentTarget && !event.isDefaultPrevented()) {\n      onOpenChange(false);\n    }\n  }\n\n  return (\n    <FullWindowOverlay>\n      <DialogPrimitive.Overlay\n        className={cn(\n          'absolute bottom-0 left-0 right-0 top-0 z-50 flex justify-end bg-black/80',\n          Platform.select({\n            web: 'fixed cursor-default [&>*]:cursor-auto',\n          }),\n          className\n        )}\n        {...props}\n        onPress={Platform.select({ web: onOverlayPress, native: onPress })}\n        asChild={Platform.OS !== 'web'}>\n        <NativeOnlyAnimatedView entering={FadeIn.duration(durations.base)} exiting={FadeOut.duration(durations.fast)}>\n          <>{children}</>\n        </NativeOnlyAnimatedView>\n      </DialogPrimitive.Overlay>\n    </FullWindowOverlay>\n  );\n}\n\ninterface BottomSheetContentProps extends React.ComponentProps<typeof DialogPrimitive.Content> {\n  portalHost?: string;\n}\n\nfunction BottomSheetContent({\n  className,\n  portalHost,\n  children,\n  ...props\n}: BottomSheetContentProps) {\n  return (\n    <BottomSheetPortal hostName={portalHost}>\n      <BottomSheetOverlay>\n        <DialogPrimitive.Content\n          className={cn(\n            'bg-background p-6 shadow-lg shadow-black/5 gap-6 text-sm ring-1 ring-foreground/5 z-50 flex flex-col w-full rounded-t-4xl border-t border-border max-h-[85%] pb-10',\n            Platform.select({\n              web: 'animate-in slide-in-from-bottom duration-250',\n            }),\n            className\n          )}\n          asChild={Platform.OS !== 'web'}\n          {...props}>\n          <NativeOnlyAnimatedView entering={SlideInDown.duration(durations.slow)} exiting={SlideOutDown.duration(durations.base)} className=\"w-full flex-col\">\n            {/* Drag Handle */}\n            <View className=\"w-12 h-1 bg-muted rounded-full self-center mb-4\" />\n            \n            <View className=\"w-full gap-4\">\n              {children}\n            </View>\n            \n            <DialogPrimitive.Close\n              className={cn(\n                'rounded opacity-70 active:opacity-100 absolute top-4 right-4',\n                Platform.select({\n                  web: 'ring-offset-background focus:ring-ring data-[state=open]:bg-accent transition-opacity hover:opacity-100 focus:outline-none focus:ring-2 focus:ring-offset-2',\n                })\n              )}\n              hitSlop={12}>\n              <Icon\n                as={X}\n                className={cn('text-accent-foreground web:pointer-events-none size-4 shrink-0')}\n              />\n              <Text className=\"sr-only\">Close</Text>\n            </DialogPrimitive.Close>\n          </NativeOnlyAnimatedView>\n        </DialogPrimitive.Content>\n      </BottomSheetOverlay>\n    </BottomSheetPortal>\n  );\n}\n\nfunction BottomSheetHeader({ className, ...props }: ViewProps) {\n  return (\n    <View className={cn('flex flex-col gap-1.5 text-left', className)} {...props} />\n  );\n}\n\nfunction BottomSheetFooter({ className, ...props }: ViewProps) {\n  return (\n    <View\n      className={cn('flex flex-col-reverse sm:flex-row sm:justify-end gap-2 mt-4', className)}\n      {...props}\n    />\n  );\n}\n\nfunction BottomSheetTitle({ className, ...props }: React.ComponentProps<typeof DialogPrimitive.Title>) {\n  return (\n    <DialogPrimitive.Title\n      className={cn('text-foreground text-lg leading-none font-semibold', className)}\n      {...props}\n    />\n  );\n}\n\nfunction BottomSheetDescription({\n  className,\n  ...props\n}: React.ComponentProps<typeof DialogPrimitive.Description>) {\n  return (\n    <DialogPrimitive.Description\n      className={cn('text-muted-foreground text-sm', className)}\n      {...props}\n    />\n  );\n}\n\nexport {\n  BottomSheet,\n  BottomSheetClose,\n  BottomSheetContent,\n  BottomSheetDescription,\n  BottomSheetFooter,\n  BottomSheetHeader,\n  BottomSheetOverlay,\n  BottomSheetPortal,\n  BottomSheetTitle,\n  BottomSheetTrigger,\n};\n",
      "type": "registry:ui"
    }
  ],
  "meta": {
    "engine": "nativewind",
    "style": "maia"
  },
  "type": "registry:ui"
}
