{
  "$schema": "https://lovdacn.vercel.app/schema/registry-item.json",
  "name": "signup-01",
  "type": "registry:block",
  "description": "A sign-up screen: an (auth) route with a registration form and terms checkbox.",
  "dependencies": [
    "react-native-safe-area-context"
  ],
  "registryDependencies": [
    "card",
    "input",
    "label",
    "button",
    "checkbox",
    "icon",
    "text",
    "utils"
  ],
  "files": [
    {
      "path": "app/(auth)/_layout.tsx",
      "content": "import { Stack } from 'expo-router';\n\n/**\n * Layout for the (auth) route group. The parentheses make it a layout group,\n * so it does not add a segment to the URL — `sign-up.tsx` is still `/sign-up`.\n */\nexport default function AuthLayout() {\n  return <Stack screenOptions={{ headerShown: false }} />;\n}\n",
      "type": "registry:page",
      "target": "app/(auth)/_layout.tsx"
    },
    {
      "path": "app/(auth)/sign-up.tsx",
      "content": "import { SignupForm } from \"@/components/signup-form\";\nimport { KeyboardAvoidingView, Platform, ScrollView, View } from \"react-native\";\nimport { SafeAreaView } from \"react-native-safe-area-context\";\n\nexport default function SignUpScreen() {\n  return (\n    <SafeAreaView className=\"bg-background flex-1\">\n      <KeyboardAvoidingView\n        className=\"flex-1\"\n        behavior={Platform.OS === \"ios\" ? \"padding\" : undefined}\n      >\n        <ScrollView\n          className=\"flex-1\"\n          contentContainerStyle={{ flexGrow: 1 }}\n          keyboardShouldPersistTaps=\"handled\"\n        >\n          <View className=\"flex-1 justify-center px-6 py-8\">\n            <SignupForm />\n          </View>\n        </ScrollView>\n      </KeyboardAvoidingView>\n    </SafeAreaView>\n  );\n}\n",
      "type": "registry:page",
      "target": "app/(auth)/sign-up.tsx"
    },
    {
      "path": "components/signup-form.tsx",
      "content": "import { Button } from '@/components/ui/button';\nimport {\n  Card,\n  CardContent,\n  CardDescription,\n  CardFooter,\n  CardHeader,\n  CardTitle,\n} from '@/components/ui/card';\nimport { Checkbox } from '@/components/ui/checkbox';\nimport { Input } from '@/components/ui/input';\nimport { Label } from '@/components/ui/label';\nimport { Text } from '@/components/ui/text';\nimport { Link } from 'expo-router';\nimport * as React from 'react';\nimport { View } from 'react-native';\n\nexport function SignupForm() {\n  const [name, setName] = React.useState('');\n  const [email, setEmail] = React.useState('');\n  const [password, setPassword] = React.useState('');\n  const [agree, setAgree] = React.useState(false);\n\n  return (\n    <Card className=\"mx-auto w-full max-w-sm\">\n      <CardHeader className=\"items-center gap-1\">\n        <CardTitle className=\"text-xl\">Create an account</CardTitle>\n        <CardDescription>Enter your details to get started</CardDescription>\n      </CardHeader>\n      <CardContent className=\"gap-4\">\n        <View className=\"gap-2\">\n          <Label nativeID=\"name\">\n            <Text>Name</Text>\n          </Label>\n          <Input\n            aria-labelledby=\"name\"\n            value={name}\n            onChangeText={setName}\n            placeholder=\"Ada Lovelace\"\n            autoComplete=\"name\"\n          />\n        </View>\n        <View className=\"gap-2\">\n          <Label nativeID=\"email\">\n            <Text>Email</Text>\n          </Label>\n          <Input\n            aria-labelledby=\"email\"\n            value={email}\n            onChangeText={setEmail}\n            placeholder=\"m@example.com\"\n            autoCapitalize=\"none\"\n            autoComplete=\"email\"\n            keyboardType=\"email-address\"\n          />\n        </View>\n        <View className=\"gap-2\">\n          <Label nativeID=\"password\">\n            <Text>Password</Text>\n          </Label>\n          <Input\n            aria-labelledby=\"password\"\n            value={password}\n            onChangeText={setPassword}\n            placeholder=\"Create a password\"\n            secureTextEntry\n            autoComplete=\"password-new\"\n          />\n        </View>\n        {/* Pressing the label toggles the checkbox: RN has no implicit\n            label->control association, so we wire onPress explicitly. */}\n        <View className=\"flex-row items-center gap-2\">\n          <Checkbox\n            checked={agree}\n            onCheckedChange={setAgree}\n            aria-labelledby=\"terms-label\"\n          />\n          <Label nativeID=\"terms-label\" onPress={() => setAgree((prev) => !prev)}>\n            <Text className=\"text-muted-foreground text-sm\">\n              I agree to the Terms and Privacy Policy\n            </Text>\n          </Label>\n        </View>\n      </CardContent>\n      <CardFooter className=\"flex-col gap-4\">\n        <Button className=\"w-full\" disabled={!agree} onPress={() => {}}>\n          <Text>Create account</Text>\n        </Button>\n        <View className=\"flex-row items-center justify-center gap-1\">\n          <Text className=\"text-muted-foreground text-sm\">Already have an account?</Text>\n          <Link href=\"/sign-in\" asChild>\n            <Button variant=\"link\" size=\"sm\" className=\"h-auto p-0\">\n              <Text>Sign in</Text>\n            </Button>\n          </Link>\n        </View>\n      </CardFooter>\n    </Card>\n  );\n}\n",
      "type": "registry:component"
    }
  ],
  "meta": {
    "style": "vega",
    "legacy": false
  }
}
