{
  "$schema": "https://lovdacn.vercel.app/schema/registry-item.json",
  "name": "sheet",
  "dependencies": [
    "@rn-primitives/dialog",
    "react-native-reanimated",
    "react-native-screens",
    "lucide-react-native"
  ],
  "registryDependencies": [
    "icon",
    "primitives",
    "text",
    "utils",
    "native-only-animated-view"
  ],
  "files": [
    {
      "path": "components/ui/sheet.tsx",
      "content": "import { Icon } from '@/components/ui/icon';\nimport { NativeOnlyAnimatedView } from '@/components/ui/native-only-animated-view';\nimport { cn } from '@/lib/utils';\nimport * as DialogPrimitive from '@rn-primitives/dialog';\nimport { X } from 'lucide-react-native';\nimport * as React from 'react';\nimport { durations, Text, View } from '@/components/ui/primitives';\nimport { Platform, type GestureResponderEvent, type ViewProps } from 'react-native';\nimport { FadeIn, FadeOut, SlideInLeft, SlideInRight, SlideOutLeft, SlideOutRight } from 'react-native-reanimated';\nimport { FullWindowOverlay as RNFullWindowOverlay } from 'react-native-screens';\n\nconst Sheet = DialogPrimitive.Root;\nconst SheetTrigger = DialogPrimitive.Trigger;\nconst SheetPortal = DialogPrimitive.Portal;\nconst SheetClose = DialogPrimitive.Close;\n\nconst FullWindowOverlay = Platform.OS === 'ios' ? RNFullWindowOverlay : React.Fragment;\n\ntype SheetSide = 'top' | 'bottom' | 'left' | 'right';\n\nconst SheetSideContext = React.createContext<{ side: SheetSide }>({ side: 'right' });\n\nfunction SheetOverlay({\n  className,\n  children,\n  onPress,\n  ...props\n}: Omit<React.ComponentProps<typeof DialogPrimitive.Overlay>, 'asChild'> & {\n  children?: React.ReactNode;\n}) {\n  const { onOpenChange } = DialogPrimitive.useRootContext();\n\n  function onOverlayPress(event: GestureResponderEvent) {\n    onPress?.(event);\n    if (event.target === event.currentTarget && !event.isDefaultPrevented()) {\n      onOpenChange(false);\n    }\n  }\n\n  return (\n    <FullWindowOverlay>\n      <DialogPrimitive.Overlay\n        className={cn(\n          'absolute bottom-0 left-0 right-0 top-0 z-50 flex bg-black/80',\n          Platform.select({\n            web: 'fixed cursor-default [&>*]:cursor-auto',\n          }),\n          className\n        )}\n        {...props}\n        onPress={Platform.select({ web: onOverlayPress, native: onPress })}\n        asChild={Platform.OS !== 'web'}>\n        <NativeOnlyAnimatedView entering={FadeIn.duration(durations.base)} exiting={FadeOut.duration(durations.fast)}>\n          <>{children}</>\n        </NativeOnlyAnimatedView>\n      </DialogPrimitive.Overlay>\n    </FullWindowOverlay>\n  );\n}\n\ninterface SheetContentProps extends React.ComponentProps<typeof DialogPrimitive.Content> {\n  side?: SheetSide;\n  portalHost?: string;\n}\n\nfunction SheetContent({\n  className,\n  portalHost,\n  side = 'right',\n  children,\n  ...props\n}: SheetContentProps) {\n  const enteringAnimation =\n    side === 'left'\n      ? SlideInLeft.duration(durations.slow)\n      : side === 'right'\n      ? SlideInRight.duration(durations.slow)\n      : undefined;\n\n  const exitingAnimation =\n    side === 'left'\n      ? SlideOutLeft.duration(durations.base)\n      : side === 'right'\n      ? SlideOutRight.duration(durations.base)\n      : undefined;\n\n  const sideStyles = {\n    left: 'left-0 h-full border-r border-border max-w-sm w-4/5',\n    right: 'right-0 h-full border-l border-border max-w-sm w-4/5',\n    top: 'top-0 w-full border-b border-border max-h-sm h-1/3',\n    bottom: 'bottom-0 w-full border-t border-border max-h-sm h-1/3',\n  };\n\n  const webAnimations = {\n    left: 'animate-in slide-in-from-left duration-250',\n    right: 'animate-in slide-in-from-right duration-250',\n    top: 'animate-in slide-in-from-top duration-250',\n    bottom: 'animate-in slide-in-from-bottom duration-250',\n  };\n\n  return (\n    <SheetPortal hostName={portalHost}>\n      <SheetOverlay>\n        <SheetSideContext.Provider value={{ side }}>\n          <DialogPrimitive.Content\n            className={cn(\n              'absolute bg-background p-6 shadow-lg shadow-black/5 gap-6 text-sm ring-1 ring-foreground/5 z-50 flex flex-col',\n              sideStyles[side],\n              Platform.select({\n                web: webAnimations[side],\n              }),\n              className\n            )}\n            asChild={Platform.OS !== 'web'}\n            {...props}>\n            <NativeOnlyAnimatedView entering={enteringAnimation} exiting={exitingAnimation} className=\"h-full w-full justify-between\">\n              <View className=\"flex-1 gap-6\">\n                {children}\n              </View>\n              <DialogPrimitive.Close\n                className={cn(\n                  'rounded opacity-70 active:opacity-100 absolute top-4 right-4',\n                  Platform.select({\n                    web: 'ring-offset-background focus:ring-ring data-[state=open]:bg-accent transition-opacity hover:opacity-100 focus:outline-none focus:ring-2 focus:ring-offset-2',\n                  })\n                )}\n                hitSlop={12}>\n                <Icon\n                  as={X}\n                  className={cn('text-accent-foreground web:pointer-events-none size-4 shrink-0')}\n                />\n                <Text className=\"sr-only\">Close</Text>\n              </DialogPrimitive.Close>\n            </NativeOnlyAnimatedView>\n          </DialogPrimitive.Content>\n        </SheetSideContext.Provider>\n      </SheetOverlay>\n    </SheetPortal>\n  );\n}\n\nfunction SheetHeader({ className, ...props }: ViewProps) {\n  return (\n    <View className={cn('flex flex-col gap-2', className)} {...props} />\n  );\n}\n\nfunction SheetFooter({ className, ...props }: ViewProps) {\n  return (\n    <View\n      className={cn('flex flex-col-reverse sm:flex-row sm:justify-end gap-2', className)}\n      {...props}\n    />\n  );\n}\n\nfunction SheetTitle({ className, ...props }: React.ComponentProps<typeof DialogPrimitive.Title>) {\n  return (\n    <DialogPrimitive.Title\n      className={cn('text-foreground text-lg leading-none font-semibold', className)}\n      {...props}\n    />\n  );\n}\n\nfunction SheetDescription({\n  className,\n  ...props\n}: React.ComponentProps<typeof DialogPrimitive.Description>) {\n  return (\n    <DialogPrimitive.Description\n      className={cn('text-muted-foreground text-sm', className)}\n      {...props}\n    />\n  );\n}\n\nexport {\n  Sheet,\n  SheetClose,\n  SheetContent,\n  SheetDescription,\n  SheetFooter,\n  SheetHeader,\n  SheetOverlay,\n  SheetPortal,\n  SheetTitle,\n  SheetTrigger,\n};\n",
      "type": "registry:ui"
    }
  ],
  "meta": {
    "engine": "uniwind",
    "style": "rhea"
  },
  "type": "registry:ui"
}
